{
  "id": "jp-local-111007",
  "official_code": "111007",
  "name_ja": "さいたま市",
  "municipality_type": "designated_city",
  "prefecture_name_ja": "埼玉県",
  "official_url": "https://www.city.saitama.lg.jp/",
  "data_status": "reviewed",
  "fiscal_years": [2024, 2026],
  "last_verified_at": "2026-08-18",
  "sources": [
    "saitama-city-home",
    "saitama-basic-plan-2021-2030",
    "saitama-implementation-plan-2026-2030",
    "saitama-implementation-plan-2021-2025",
    "saitama-progress-2024",
    "saitama-budget-2026",
    "saitama-policy-statement-2026",
    "saitama-settlement-2024-overview"
  ]
}
