{
  "id": "jp-local-121002",
  "official_code": "121002",
  "name_ja": "千葉市",
  "municipality_type": "designated_city",
  "prefecture_name_ja": "千葉県",
  "official_url": "https://www.city.chiba.jp/",
  "data_status": "reviewed",
  "fiscal_years": [
    2024,
    2026
  ],
  "last_verified_at": "2026-09-24",
  "sources": [
    "chiba-city-home",
    "chiba-basic-plan-2023-2032",
    "chiba-implementation-plan-2026-2028",
    "chiba-implementation-plan-2026-2028-full-pdf",
    "chiba-implementation-plan-2023-2025",
    "chiba-implementation-plan-2023-2025-full-pdf",
    "chiba-implementation-progress-2024-settlement",
    "chiba-budget-2026",
    "chiba-budget-2026-enactment",
    "chiba-settlement-2024-overview"
  ]
}
