{
  "id": "jp-local-281000",
  "official_code": "281000",
  "name_ja": "神戸市",
  "municipality_type": "designated_city",
  "prefecture_name_ja": "兵庫県",
  "official_url": "https://www.city.kobe.lg.jp/",
  "data_status": "reviewed",
  "fiscal_years": [
    2024,
    2026
  ],
  "last_verified_at": "2026-09-29",
  "sources": [
    "kobe-sixth-basic-plan",
    "kobe-2030-vision",
    "kobe-2030-progress-governance",
    "kobe-budget-2026-enacted",
    "kobe-settlement-2024"
  ]
}
