{
  "id": "jp-local-012025",
  "official_code": "012025",
  "name_ja": "函館市",
  "municipality_type": "core_city",
  "prefecture_name_ja": "北海道",
  "official_url": "https://www.city.hakodate.hokkaido.jp/",
  "data_status": "reviewed",
  "fiscal_years": [
    2024,
    2026
  ],
  "last_verified_at": "2026-10-01",
  "sources": [
    "hakodate-city-home",
    "hakodate-budget-2026-pdf",
    "hakodate-settlement-2024-audit-pdf"
  ]
}
