{
  "id": "jp-local-032018",
  "official_code": "032018",
  "name_ja": "盛岡市",
  "municipality_type": "core_city",
  "prefecture_name_ja": "岩手県",
  "official_url": "https://www.city.morioka.iwate.jp/",
  "data_status": "reviewed",
  "fiscal_years": [
    2024,
    2026
  ],
  "last_verified_at": "2026-10-01",
  "sources": [
    "morioka-city-home",
    "morioka-budget-2026-page",
    "morioka-budget-2026-council",
    "morioka-settlement-2024-page"
  ]
}
