{
  "id": "jp-local-011002",
  "official_code": "011002",
  "name_ja": "札幌市",
  "municipality_type": "designated_city",
  "prefecture_name_ja": "北海道",
  "official_url": "https://www.city.sapporo.jp/",
  "data_status": "reviewed",
  "fiscal_years": [2024, 2026],
  "last_verified_at": "2026-08-08",
  "sources": [
    "sapporo-city-home",
    "sapporo-city-budget-2026-page",
    "sapporo-city-settlement-2024-page"
  ]
}
